{
  "duration": {
    "totalSeconds": 2,
    "startTime": "2025-10-22T23:49:04.847Z",
    "endTime": "2025-10-22T23:49:06.825Z"
  },
  "counts": {
    "totalPages": 1,
    "totalEdges": 1,
    "totalAssets": 0,
    "totalErrors": 0
  },
  "throughput": {
    "avgPagesPerSec": 0.51,
    "bytesWritten": 1273,
    "bytesWrittenMB": 0
  },
  "memory": {
    "currentRssMB": 171,
    "peakRssMB": 171
  },
  "timings": {
    "fetch": {
      "p50": 291,
      "p95": 291,
      "p99": 291,
      "count": 1
    },
    "render": {
      "p50": 1135,
      "p95": 1135,
      "p99": 1135,
      "count": 1
    },
    "extract": {
      "p50": 27,
      "p95": 27,
      "p99": 27,
      "count": 1
    },
    "write": {
      "p50": 0,
      "p95": 0,
      "p99": 0,
      "count": 1
    }
  }
}